{
  "fixture": {
    "id": "oval-pan8-390-510-v1",
    "seed": "9112A7AB",
    "race": 1000001,
    "oval": 1,
    "tier": 1,
    "camera": 8,
    "start": 390,
    "end": 510,
    "contexts": 120,
    "repetitions": 3,
    "independent": false,
    "finish": "5DC86E18"
  },
  "manifest_sha256": "84e0341ee1ac10c232e3008f28f8aada8823155e19229f926e633d7780a2021d",
  "variant": "baseline",
  "session": "1",
  "independent_trials": false,
  "all_repetitions_valid": true,
  "repetitions": [
    {
      "v": "1",
      "fixture": "oval-pan8-390-510-v1",
      "manifest": "84e0341ee1ac10c232e3008f28f8aada8823155e19229f926e633d7780a2021d",
      "variant": "baseline",
      "session": "1",
      "rep": "1",
      "seq": "1",
      "valid": "1",
      "quality": "0",
      "independent": "0",
      "seed": "9112A7AB",
      "oval": "1",
      "tier": "1",
      "cam": "8",
      "start": "390",
      "end": "510",
      "contexts": "120",
      "done": "120",
      "cont": "0",
      "capture": "0",
      "faults": "0",
      "refused": "0",
      "tx_fail": "0",
      "wall_us": "1074969",
      "work_us": "1074525",
      "finish": "5DC86E18",
      "p0": "0:0:0",
      "p1": "0:0:0",
      "p2": "0:0:0",
      "c0": "0",
      "c1": "120",
      "c2": "600",
      "c3": "7735",
      "c4": "7735",
      "c5": "0",
      "c6": "0",
      "c7": "0",
      "c8": "0",
      "c9": "0",
      "s0": "746033:120",
      "s1": "5436:2086",
      "s2": "70409:4569",
      "s3": "6808:4975",
      "s4": "71966:14925",
      "s5": "0:0",
      "s6": "62574:120",
      "s7": "1202:2040",
      "s8": "0:0",
      "s9": "0:0"
    },
    {
      "v": "1",
      "fixture": "oval-pan8-390-510-v1",
      "manifest": "84e0341ee1ac10c232e3008f28f8aada8823155e19229f926e633d7780a2021d",
      "variant": "baseline",
      "session": "1",
      "rep": "2",
      "seq": "2",
      "valid": "1",
      "quality": "0",
      "independent": "0",
      "seed": "9112A7AB",
      "oval": "1",
      "tier": "1",
      "cam": "8",
      "start": "390",
      "end": "510",
      "contexts": "120",
      "done": "120",
      "cont": "0",
      "capture": "0",
      "faults": "0",
      "refused": "0",
      "tx_fail": "0",
      "wall_us": "973111",
      "work_us": "972625",
      "finish": "5DC86E18",
      "p0": "0:0:0",
      "p1": "0:0:0",
      "p2": "0:0:0",
      "c0": "0",
      "c1": "120",
      "c2": "600",
      "c3": "7735",
      "c4": "7735",
      "c5": "0",
      "c6": "0",
      "c7": "0",
      "c8": "0",
      "c9": "0",
      "s0": "653510:120",
      "s1": "5352:2086",
      "s2": "70217:4569",
      "s3": "7069:4975",
      "s4": "71266:14925",
      "s5": "0:0",
      "s6": "59292:120",
      "s7": "1374:2040",
      "s8": "0:0",
      "s9": "0:0"
    },
    {
      "v": "1",
      "fixture": "oval-pan8-390-510-v1",
      "manifest": "84e0341ee1ac10c232e3008f28f8aada8823155e19229f926e633d7780a2021d",
      "variant": "baseline",
      "session": "1",
      "rep": "3",
      "seq": "3",
      "valid": "1",
      "quality": "0",
      "independent": "0",
      "seed": "9112A7AB",
      "oval": "1",
      "tier": "1",
      "cam": "8",
      "start": "390",
      "end": "510",
      "contexts": "120",
      "done": "120",
      "cont": "0",
      "capture": "0",
      "faults": "0",
      "refused": "0",
      "tx_fail": "0",
      "wall_us": "964296",
      "work_us": "963836",
      "finish": "5DC86E18",
      "p0": "0:0:0",
      "p1": "0:0:0",
      "p2": "0:0:0",
      "c0": "0",
      "c1": "120",
      "c2": "600",
      "c3": "7735",
      "c4": "7735",
      "c5": "0",
      "c6": "0",
      "c7": "0",
      "c8": "0",
      "c9": "0",
      "s0": "657306:120",
      "s1": "4976:2086",
      "s2": "67874:4569",
      "s3": "6546:4975",
      "s4": "68759:14925",
      "s5": "0:0",
      "s6": "58743:120",
      "s7": "1186:2040",
      "s8": "0:0",
      "s9": "0:0"
    }
  ],
  "transport_sha256": "ab1d7d3c63fa0c765b3c9f341c1648adee1b37624f81ea054adb47fabb694dc1"
}
